{"schema_version":"0.1","analysis_id":"batch_0283a199001e8bbe2ae0ebf0","analysis_type":"PREREGISTERED_FULL_FACTORIAL_BATCH","rule_version":"full-factorial-batch/0.1","coverage_status":"COMPLETE","hypothesis_status":"SUPPORTED","runtime_overlap_claim":"NOT_PROVEN","batch_plan":{"id":"unit-batch-analysis","version":1,"sha256":"892920595ab55586a60af83f1da6a7708cc99c4f8e12ed119fc0d99f3e809ba2"},"primary_variable":{"name":"batch_profile","source":"unit-fixture","unit":"profile"},"execution_policy":{"order_algorithm":"SHA256_RANK_V1","seed":20260811,"perturbation_repetitions":1,"max_parallel":2,"memory_budget_mb":512,"preflight_between_waves":true,"cleanup_between_waves":true},"reasons":[{"code":"BATCH_HYPOTHESIS_SUPPORTED","message":"Deterministic batch-analysis fixture."}],"slots":[{"slot_id":"coverage-01","phase":"COVERAGE","repetition":0,"wave":1,"position":1,"profile_id":"baseline","source":{"run_id":"unit-batch-run-1","created_at":"2026-08-11T00:00:00Z","execution_status":"COMPLETED","verdict":"PASS","plan":{"id":"unit-plan-baseline","version":4,"sha256":"aaaaaaaaaaaaaaaaaaaaaaaaaaaaaaaaaaaaaaaaaaaaaaaaaaaaaaaaaaaaaaaa"},"random_seed":20260811,"primary_variable":{"name":"batch_profile","role":"PRIMARY","value":"baseline","source":"unit-fixture","unit":"profile"},"bundle_sha256":"5555555555555555555555555555555555555555555555555555555555555555","control_projection_sha256":"eeeeeeeeeeeeeeeeeeeeeeeeeeeeeeeeeeeeeeeeeeeeeeeeeeeeeeeeeeeeeeee","preflight_complete":true,"cleanup_complete":true,"browser_complete":true,"static_root_fingerprint":"1111111111111111111111111111111111111111111111111111111111111111"},"outcomes":[{"assertion_id":"console-errors-zero","expected_actual":0,"actual":0,"matches":true}]},{"slot_id":"coverage-02","phase":"COVERAGE","repetition":0,"wave":2,"position":1,"profile_id":"queue-only","source":{"run_id":"unit-batch-run-2","created_at":"2026-08-11T00:00:01Z","execution_status":"COMPLETED","verdict":"PASS","plan":{"id":"unit-plan-queue-only","version":4,"sha256":"bbbbbbbbbbbbbbbbbbbbbbbbbbbbbbbbbbbbbbbbbbbbbbbbbbbbbbbbbbbbbbbb"},"random_seed":20260811,"primary_variable":{"name":"batch_profile","role":"PRIMARY","value":"queue-only","source":"unit-fixture","unit":"profile"},"bundle_sha256":"6666666666666666666666666666666666666666666666666666666666666666","control_projection_sha256":"eeeeeeeeeeeeeeeeeeeeeeeeeeeeeeeeeeeeeeeeeeeeeeeeeeeeeeeeeeeeeeee","preflight_complete":true,"cleanup_complete":true,"browser_complete":true,"static_root_fingerprint":"2222222222222222222222222222222222222222222222222222222222222222"},"outcomes":[{"assertion_id":"console-errors-zero","expected_actual":0,"actual":0,"matches":true}]},{"slot_id":"coverage-03","phase":"COVERAGE","repetition":0,"wave":3,"position":1,"profile_id":"cache-only","source":{"run_id":"unit-batch-run-3","created_at":"2026-08-11T00:00:02Z","execution_status":"COMPLETED","verdict":"PASS","plan":{"id":"unit-plan-cache-only","version":4,"sha256":"cccccccccccccccccccccccccccccccccccccccccccccccccccccccccccccccc"},"random_seed":20260811,"primary_variable":{"name":"batch_profile","role":"PRIMARY","value":"cache-only","source":"unit-fixture","unit":"profile"},"bundle_sha256":"7777777777777777777777777777777777777777777777777777777777777777","control_projection_sha256":"eeeeeeeeeeeeeeeeeeeeeeeeeeeeeeeeeeeeeeeeeeeeeeeeeeeeeeeeeeeeeeee","preflight_complete":true,"cleanup_complete":true,"browser_complete":true,"static_root_fingerprint":"3333333333333333333333333333333333333333333333333333333333333333"},"outcomes":[{"assertion_id":"console-errors-zero","expected_actual":0,"actual":0,"matches":true}]},{"slot_id":"coverage-04","phase":"COVERAGE","repetition":0,"wave":4,"position":1,"profile_id":"combined","source":{"run_id":"unit-batch-run-4","created_at":"2026-08-11T00:00:03Z","execution_status":"COMPLETED","verdict":"FAIL","plan":{"id":"unit-plan-combined","version":4,"sha256":"dddddddddddddddddddddddddddddddddddddddddddddddddddddddddddddddd"},"random_seed":20260811,"primary_variable":{"name":"batch_profile","role":"PRIMARY","value":"combined","source":"unit-fixture","unit":"profile"},"bundle_sha256":"8888888888888888888888888888888888888888888888888888888888888888","control_projection_sha256":"eeeeeeeeeeeeeeeeeeeeeeeeeeeeeeeeeeeeeeeeeeeeeeeeeeeeeeeeeeeeeeee","preflight_complete":true,"cleanup_complete":true,"browser_complete":true,"static_root_fingerprint":"4444444444444444444444444444444444444444444444444444444444444444"},"outcomes":[{"assertion_id":"console-errors-zero","expected_actual":1,"actual":1,"matches":true}]},{"slot_id":"perturbation-01","phase":"PERTURBATION","repetition":1,"wave":1,"position":1,"profile_id":"combined","source":{"run_id":"unit-batch-run-5","created_at":"2026-08-11T00:00:04Z","execution_status":"COMPLETED","verdict":"FAIL","plan":{"id":"unit-plan-combined","version":4,"sha256":"dddddddddddddddddddddddddddddddddddddddddddddddddddddddddddddddd"},"random_seed":20260811,"primary_variable":{"name":"batch_profile","role":"PRIMARY","value":"combined","source":"unit-fixture","unit":"profile"},"bundle_sha256":"9999999999999999999999999999999999999999999999999999999999999999","control_projection_sha256":"eeeeeeeeeeeeeeeeeeeeeeeeeeeeeeeeeeeeeeeeeeeeeeeeeeeeeeeeeeeeeeee","preflight_complete":true,"cleanup_complete":true,"browser_complete":true,"static_root_fingerprint":"4444444444444444444444444444444444444444444444444444444444444444"},"outcomes":[{"assertion_id":"console-errors-zero","expected_actual":1,"actual":1,"matches":true}]},{"slot_id":"perturbation-02","phase":"PERTURBATION","repetition":1,"wave":1,"position":2,"profile_id":"cache-only","source":{"run_id":"unit-batch-run-6","created_at":"2026-08-11T00:00:04Z","execution_status":"COMPLETED","verdict":"PASS","plan":{"id":"unit-plan-cache-only","version":4,"sha256":"cccccccccccccccccccccccccccccccccccccccccccccccccccccccccccccccc"},"random_seed":20260811,"primary_variable":{"name":"batch_profile","role":"PRIMARY","value":"cache-only","source":"unit-fixture","unit":"profile"},"bundle_sha256":"aaaaaaaaaaaaaaaaaaaaaaaaaaaaaaaaaaaaaaaaaaaaaaaaaaaaaaaaaaaaaaaa","control_projection_sha256":"eeeeeeeeeeeeeeeeeeeeeeeeeeeeeeeeeeeeeeeeeeeeeeeeeeeeeeeeeeeeeeee","preflight_complete":true,"cleanup_complete":true,"browser_complete":true,"static_root_fingerprint":"3333333333333333333333333333333333333333333333333333333333333333"},"outcomes":[{"assertion_id":"console-errors-zero","expected_actual":0,"actual":0,"matches":true}]},{"slot_id":"perturbation-03","phase":"PERTURBATION","repetition":1,"wave":2,"position":1,"profile_id":"baseline","source":{"run_id":"unit-batch-run-7","created_at":"2026-08-11T00:00:05Z","execution_status":"COMPLETED","verdict":"PASS","plan":{"id":"unit-plan-baseline","version":4,"sha256":"aaaaaaaaaaaaaaaaaaaaaaaaaaaaaaaaaaaaaaaaaaaaaaaaaaaaaaaaaaaaaaaa"},"random_seed":20260811,"primary_variable":{"name":"batch_profile","role":"PRIMARY","value":"baseline","source":"unit-fixture","unit":"profile"},"bundle_sha256":"bbbbbbbbbbbbbbbbbbbbbbbbbbbbbbbbbbbbbbbbbbbbbbbbbbbbbbbbbbbbbbbb","control_projection_sha256":"eeeeeeeeeeeeeeeeeeeeeeeeeeeeeeeeeeeeeeeeeeeeeeeeeeeeeeeeeeeeeeee","preflight_complete":true,"cleanup_complete":true,"browser_complete":true,"static_root_fingerprint":"1111111111111111111111111111111111111111111111111111111111111111"},"outcomes":[{"assertion_id":"console-errors-zero","expected_actual":0,"actual":0,"matches":true}]},{"slot_id":"perturbation-04","phase":"PERTURBATION","repetition":1,"wave":2,"position":2,"profile_id":"queue-only","source":{"run_id":"unit-batch-run-8","created_at":"2026-08-11T00:00:05Z","execution_status":"COMPLETED","verdict":"PASS","plan":{"id":"unit-plan-queue-only","version":4,"sha256":"bbbbbbbbbbbbbbbbbbbbbbbbbbbbbbbbbbbbbbbbbbbbbbbbbbbbbbbbbbbbbbbb"},"random_seed":20260811,"primary_variable":{"name":"batch_profile","role":"PRIMARY","value":"queue-only","source":"unit-fixture","unit":"profile"},"bundle_sha256":"cccccccccccccccccccccccccccccccccccccccccccccccccccccccccccccccc","control_projection_sha256":"eeeeeeeeeeeeeeeeeeeeeeeeeeeeeeeeeeeeeeeeeeeeeeeeeeeeeeeeeeeeeeee","preflight_complete":true,"cleanup_complete":true,"browser_complete":true,"static_root_fingerprint":"2222222222222222222222222222222222222222222222222222222222222222"},"outcomes":[{"assertion_id":"console-errors-zero","expected_actual":0,"actual":0,"matches":true}]}],"profiles":[{"id":"baseline","cells":{"cache-mode":"off","queue-mode":"off"},"occurrence_count":2,"completed_count":2,"mismatch_count":0},{"id":"queue-only","cells":{"cache-mode":"off","queue-mode":"on"},"occurrence_count":2,"completed_count":2,"mismatch_count":0},{"id":"cache-only","cells":{"cache-mode":"on","queue-mode":"off"},"occurrence_count":2,"completed_count":2,"mismatch_count":0},{"id":"combined","cells":{"cache-mode":"on","queue-mode":"on"},"occurrence_count":2,"completed_count":2,"mismatch_count":0}],"unplanned_differences":[],"limits":["Profile-level observations do not prove component-level causality or statistical interaction.","A wave is a sealed resource envelope and does not prove real runtime overlap."]}